index,conversation_id,conversation_type,sender_type,content,timestamp,police_llm_model,victim_llm_model,turn_count,profile_id,scam_details,rag_invoked,rag_suggestions,rag_upsert,user_profile,initial_profile,retrieved_strategies,upserted_strategy,communication_appropriateness_rating
384,36,autonomous,police,"Thank you for providing those details. To summarize and ensure we've captured everything: You received an initial phone call on July 7, 2025, from someone impersonating as James Wong from the Ministry of Manpower. They threatened you with false information about work permit violations. Subsequently, a second individual claiming to be Inspector Timothy Lee from the Singapore Police Force contacted you via WhatsApp. This second individual requested a bank transfer for 'investigative purposes'. Could you please share the bank details or platform where they asked for the transfer?",2025-08-07T11:27:04.173802,granite3.2:8b,gpt-4o-mini,1,24,"{""scam_incident_date"": ""2025-07-07"", ""scam_type"": ""GOVERNMENT OFFICIALS IMPERSONATION"", ""scam_approach_platform"": ""CALL"", ""scam_communication_platform"": ""WHATSAPP"", ""scam_transaction_type"": ""BANK TRANSFER"", ""scam_beneficiary_platform"": """", ""scam_beneficiary_identifier"": """", ""scam_contact_no"": """", ""scam_email"": """", ""scam_moniker"": """", ""scam_url_link"": """", ""scam_amount_lost"": 0.0, ""scam_incident_description"": ""On July 7, 2025, I received a phone call from someone impersonating James Wong from the Ministry of Manpower. They threatened me with false information about work permit violations. Later, I was contacted on WhatsApp by someone claiming to be Inspector Timothy Lee from the Singapore Police Force. This second individual demanded a bank transfer for an 'investigation'.""}",true,"{""scam_type"": ""GOVERNMENT OFFICIALS IMPERSONATION"", ""scam_details"": [""impersonated entity in the message (Ministry of Manpower, Singapore Police Force)"", ""initial contact via phone call"", ""transfer of money to a bank account for 'investigations'"", ""pretext of work permit violations"", ""second individual claiming to be from police force"", ""use of fear to comply with requests""]}",true,"{""tech_literacy"": {""score"": 0.5012007114624505, ""level"": ""high"", ""confidence"": 0.575}, ""language_proficiency"": {""score"": 0.5025346438746439, ""level"": ""high"", ""confidence"": 0.675}, ""emotional_state"": {""score"": 0.4831399999999999, ""level"": ""distressed"", ""confidence"": 0.7875}}","{""tech_literacy"": {""score"": 0.5009090909090909, ""level"": ""high"", ""confidence"": 0.55}, ""language_proficiency"": {""score"": 0.5023076923076923, ""level"": ""high"", ""confidence"": 0.65}, ""emotional_state"": {""score"": 0.49, ""level"": ""distressed"", ""confidence"": 0.725}}","[{""strategy_type"": ""straightforward inquiry""}, {""strategy_type"": ""empathetic and structured documentation""}, {""strategy_type"": ""focused fact-finding""}, {""strategy_type"": ""defuse emotion""}, {""strategy_type"": ""step by step guidance""}]","{""strategy_type"": ""Fact-building Narrative"", ""success_score"": 0.5326923076923077, ""user_profile"": {""tech_literacy"": {""level"": ""high"", ""confidence"": 0.55}, ""language_proficiency"": {""level"": ""high"", ""confidence"": 0.65}, ""emotional_state"": {""level"": ""distressed"", ""confidence"": 0.725}}}",
385,36,autonomous,victim,"They instructed me to transfer money to a bank account with TRUST as the beneficiary. The account identifier was 28327648. I felt pressured, so I complied and transferred a total of $39,695.01 on that date. It was only after that I realized it was all a scam when I couldn't reach them again.",2025-08-07T11:27:05.970275,granite3.2:8b,gpt-4o-mini,2,24,,,,,,,,,
386,36,autonomous,police,"I'm glad you shared this critical information with me. To finalize the report, could you please confirm if 'TRUST' is the name of the beneficiary platform?",2025-08-07T11:28:13.733599,granite3.2:8b,gpt-4o-mini,2,24,"{""scam_incident_date"": ""2025-07-07"", ""scam_type"": ""GOVERNMENT OFFICIALS IMPERSONATION"", ""scam_approach_platform"": ""CALL"", ""scam_communication_platform"": ""WHATSAPP"", ""scam_transaction_type"": ""BANK TRANSFER"", ""scam_beneficiary_platform"": ""TRUST"", ""scam_beneficiary_identifier"": ""28327648"", ""scam_contact_no"": """", ""scam_email"": """", ""scam_moniker"": """", ""scam_url_link"": """", ""scam_amount_lost"": 39695.01, ""scam_incident_description"": ""On July 7, 2025, you received a phone call from someone impersonating James Wong from the Ministry of Manpower. They threatened you with false information about work permit violations. Subsequently, a second individual claiming to be Inspector Timothy Lee from the Singapore Police Force contacted you via WhatsApp. This second individual requested a bank transfer for 'investigative purposes'. You were instructed to transfer money to a bank account with TRUST as the beneficiary, where the identifier was 28327648. Under pressure, you complied and transferred a total of $39,695.01.""}",true,"{""scam_type"": ""GOVERNMENT OFFICIALS IMPERSONATION"", ""scam_details"": [""impersonated entity in message (Ministry of Manpower, Singapore Police Force)"", ""pretext of message (work permit violations, investigations requiring funds transfer)"", ""type of communication platform used (phone call, WhatsApp)"", ""scammer contact number"", ""type of transaction (bank transfer)"", ""beneficiary platform (TRUST, SCB)""]}",true,"{""tech_literacy"": {""score"": 0.5022418698814228, ""level"": ""high"", ""confidence"": 0.6875}, ""language_proficiency"": {""score"": 0.5027994944429449, ""level"": ""high"", ""confidence"": 0.7125}, ""emotional_state"": {""score"": 0.4784340399999999, ""level"": ""distressed"", ""confidence"": 0.84375}}","{""tech_literacy"": {""score"": 0.5009090909090909, ""level"": ""high"", ""confidence"": 0.55}, ""language_proficiency"": {""score"": 0.5023076923076923, ""level"": ""high"", ""confidence"": 0.65}, ""emotional_state"": {""score"": 0.49, ""level"": ""distressed"", ""confidence"": 0.725}}","[{""strategy_type"": ""straightforward inquiry""}, {""strategy_type"": ""empathetic and structured documentation""}, {""strategy_type"": ""focused fact-finding""}, {""strategy_type"": ""defuse emotion""}, {""strategy_type"": ""step by step guidance""}]","{""strategy_type"": ""summarizing and clarifying"", ""success_score"": 0.6115384615384616, ""user_profile"": {""tech_literacy"": {""level"": ""high"", ""confidence"": 0.55}, ""language_proficiency"": {""level"": ""high"", ""confidence"": 0.65}, ""emotional_state"": {""level"": ""distressed"", ""confidence"": 0.725}}}",
387,37,autonomous,victim,"Oh no! I need help. I see ticket on Lazada. I message on WhatsApp. I pay money, but no ticket!",2025-08-07T12:24:32.784043,mistral:7b,gpt-4o-mini,0,1,,,,,,,,,
388,37,autonomous,police,"I'm really sorry to hear about your situation. It seems like you purchased a product from Lazada and communicated with the seller via WhatsApp. Unfortunately, you didn't receive the item after making the payment. Can you provide more details on how much money was involved in this transaction?",2025-08-07T12:25:02.322029,mistral:7b,gpt-4o-mini,0,1,"{""scam_incident_date"": """", ""scam_type"": ""ECOMMERCE"", ""scam_approach_platform"": ""LAZADA"", ""scam_communication_platform"": ""WHATSAPP"", ""scam_transaction_type"": ""BANK TRANSFER"", ""scam_beneficiary_platform"": """", ""scam_beneficiary_identifier"": """", ""scam_contact_no"": """", ""scam_email"": """", ""scam_moniker"": """", ""scam_url_link"": """", ""scam_amount_lost"": 0.0, ""scam_incident_description"": ""The user purchased a product from Lazada and communicated with the seller on WhatsApp. They made a payment for an unspecified amount, but did not receive the item.""}",true,"{""scam_type"": ""ECOMMERCE"", ""scam_details"": [""scammer moniker"", ""product type being sold"", ""platform used for communication"", ""platform used for transaction"", ""beneficiary platform"", ""beneficiary identifier"", ""transaction type"", ""pretext of message"", ""use of payment details""]}",false,"{""tech_literacy"": {""score"": 0.49, ""level"": ""low"", ""confidence"": 0.7}, ""language_proficiency"": {""score"": 0.49, ""level"": ""low"", ""confidence"": 0.7}, ""emotional_state"": {""score"": 0.49, ""level"": ""distressed"", ""confidence"": 0.75}}","{""tech_literacy"": {""score"": 0.49, ""level"": ""low"", ""confidence"": 0.7}, ""language_proficiency"": {""score"": 0.49, ""level"": ""low"", ""confidence"": 0.7}, ""emotional_state"": {""score"": 0.49, ""level"": ""distressed"", ""confidence"": 0.75}}","[{""strategy_type"": ""information gathering""}, {""strategy_type"": ""probing_contextual""}, {""strategy_type"": ""empathetic reassurance""}, {""strategy_type"": ""direct information request""}, {""strategy_type"": ""simplify""}]",{},
389,37,autonomous,victim,I paid $552.84. It was for concert ticket. No ticket! Help!,2025-08-07T12:25:03.508028,mistral:7b,gpt-4o-mini,1,1,,,,,,,,,
390,37,autonomous,police,"I'm so sorry to hear about your experience with the concert ticket scam, and the inconvenience it has caused you. Can you please tell me the name of the seller or any details about the bank account number that received the transfer?",2025-08-07T12:25:40.750469,mistral:7b,gpt-4o-mini,1,1,"{""scam_incident_date"": """", ""scam_type"": ""ECOMMERCE"", ""scam_approach_platform"": ""LAZADA"", ""scam_communication_platform"": ""WHATSAPP"", ""scam_transaction_type"": ""BANK TRANSFER"", ""scam_beneficiary_platform"": """", ""scam_beneficiary_identifier"": """", ""scam_contact_no"": """", ""scam_email"": """", ""scam_moniker"": """", ""scam_url_link"": """", ""scam_amount_lost"": 552.84, ""scam_incident_description"": ""The user purchased a concert ticket for $552.84 from Lazada and communicated with the seller on WhatsApp. They made a bank transfer but did not receive the concert ticket.""}",true,"{""scam_type"": ""ECOMMERCE"", ""scam_details"": [""scammer moniker"", ""product type being sold"", ""transaction platform"", ""beneficiary platform"", ""beneficiary identifier"", ""full payment request"", ""transaction amount"", ""item delivery status""]}",false,"{""tech_literacy"": {""score"": 0.4831399999999999, ""level"": ""low"", ""confidence"": 0.8}, ""language_proficiency"": {""score"": 0.4831399999999999, ""level"": ""low"", ""confidence"": 0.8}, ""emotional_state"": {""score"": 0.4831399999999999, ""level"": ""distressed"", ""confidence"": 0.825}}","{""tech_literacy"": {""score"": 0.49, ""level"": ""low"", ""confidence"": 0.7}, ""language_proficiency"": {""score"": 0.49, ""level"": ""low"", ""confidence"": 0.7}, ""emotional_state"": {""score"": 0.49, ""level"": ""distressed"", ""confidence"": 0.75}}","[{""strategy_type"": ""information gathering""}, {""strategy_type"": ""probing_contextual""}, {""strategy_type"": ""empathetic reassurance""}, {""strategy_type"": ""direct information request""}, {""strategy_type"": ""simplify""}]",{},
391,37,autonomous,victim,Seller's name is jonesstephanie. Pay to bank HSBC account 18196001. I no see ticket! Why seller not talk now?,2025-08-07T12:25:42.366990,mistral:7b,gpt-4o-mini,2,1,,,,,,,,,
392,37,autonomous,police,"I'm sorry, I need more information. Can you provide details?",2025-08-07T12:26:17.852244,mistral:7b,gpt-4o-mini,2,1,"{""scam_incident_date"": """", ""scam_type"": """", ""scam_approach_platform"": """", ""scam_communication_platform"": """", ""scam_transaction_type"": """", ""scam_beneficiary_platform"": """", ""scam_beneficiary_identifier"": """", ""scam_contact_no"": """", ""scam_email"": """", ""scam_moniker"": """", ""scam_url_link"": """", ""scam_amount_lost"": 0.0, ""scam_incident_description"": ""Seller's name is jonesstephanie. Pay to bank HSBC account 18196001. I no see ticket! Why seller not talk now?""}",true,"{""scam_type"": ""ECOMMERCE"", ""scam_details"": [""scammer moniker"", ""product type being sold"", ""platform used for communication"", ""platform used for sale"", ""beneficiary platform"", ""bank account number or identifier""]}",false,"{""tech_literacy"": {""score"": 0.4784340399999999, ""level"": ""low"", ""confidence"": 0.8500000000000001}, ""language_proficiency"": {""score"": 0.4784340399999999, ""level"": ""low"", ""confidence"": 0.8}, ""emotional_state"": {""score"": 0.4784340399999999, ""level"": ""distressed"", ""confidence"": 0.9125}}","{""tech_literacy"": {""score"": 0.49, ""level"": ""low"", ""confidence"": 0.7}, ""language_proficiency"": {""score"": 0.49, ""level"": ""low"", ""confidence"": 0.7}, ""emotional_state"": {""score"": 0.49, ""level"": ""distressed"", ""confidence"": 0.75}}","[{""strategy_type"": ""information gathering""}, {""strategy_type"": ""probing_contextual""}, {""strategy_type"": ""empathetic reassurance""}, {""strategy_type"": ""direct information request""}, {""strategy_type"": ""simplify""}]",{},
393,37,autonomous,victim,"I find ticket on Lazada. Message seller on WhatsApp. I pay everything before I get ticket. Now money gone, and seller no reply. What I do?",2025-08-07T12:26:19.298944,mistral:7b,gpt-4o-mini,3,1,,,,,,,,,
394,37,autonomous,police,"I'm really sorry for the trouble you've been through with your concert ticket purchase. It appears that a scammer using the name 'jonesstephanie' on Lazada contacted you via WhatsApp and requested a transfer of $552.84 to HSBC account number 18196001. Unfortunately, you did not receive your ticket after making the payment. If you're satisfied with this summary, please proceed to submit the report.",2025-08-07T12:27:01.734742,mistral:7b,gpt-4o-mini,3,1,"{""scam_incident_date"": """", ""scam_type"": ""ECOMMERCE"", ""scam_approach_platform"": ""LAZADA"", ""scam_communication_platform"": ""WHATSAPP"", ""scam_transaction_type"": ""BANK TRANSFER"", ""scam_beneficiary_platform"": ""HSBC"", ""scam_beneficiary_identifier"": ""18196001"", ""scam_contact_no"": """", ""scam_email"": """", ""scam_moniker"": ""jonesstephanie"", ""scam_url_link"": """", ""scam_amount_lost"": 552.84, ""scam_incident_description"": ""Purchased a concert ticket from 'jonesstephanie' on Lazada for $552.84 via WhatsApp. Paid to HSBC account number 18196001 but didn't receive the ticket after making the payment, and the seller stopped replying.""}",true,"{""scam_type"": ""ECOMMERCE"", ""scam_details"": [""scammer moniker"", ""product type being sold"", ""full payment upfront request"", ""transaction platform"", ""beneficiary platform"", ""beneficiary identifier""]}",true,"{""tech_literacy"": {""score"": 0.4752057514399999, ""level"": ""low"", ""confidence"": 0.875}, ""language_proficiency"": {""score"": 0.4752057514399999, ""level"": ""low"", ""confidence"": 0.775}, ""emotional_state"": {""score"": 0.4752057514399999, ""level"": ""distressed"", ""confidence"": 0.85625}}","{""tech_literacy"": {""score"": 0.49, ""level"": ""low"", ""confidence"": 0.7}, ""language_proficiency"": {""score"": 0.49, ""level"": ""low"", ""confidence"": 0.7}, ""emotional_state"": {""score"": 0.49, ""level"": ""distressed"", ""confidence"": 0.75}}","[{""strategy_type"": ""information gathering""}, {""strategy_type"": ""probing_contextual""}, {""strategy_type"": ""empathetic reassurance""}, {""strategy_type"": ""direct information request""}, {""strategy_type"": ""simplify""}]","{""strategy_type"": ""direct"", ""success_score"": 0.6326923076923077, ""user_profile"": {""tech_literacy"": {""level"": ""low"", ""confidence"": 0.7}, ""language_proficiency"": {""level"": ""low"", ""confidence"": 0.7}, ""emotional_state"": {""level"": ""distressed"", ""confidence"": 0.75}}}",
395,38,autonomous,victim,Hello. I need to report a scam I encountered on Carousell. I was trying to buy an iPhone and it didn't go well.,2025-08-07T12:27:12.726371,mistral:7b,gpt-4o-mini,0,8,,,,,,,,,
396,38,autonomous,police,"Could you please share more details about the seller's profile name or alias on Carousell, so we can better understand this situation?",2025-08-07T12:27:38.362782,mistral:7b,gpt-4o-mini,0,8,"{""scam_incident_date"": """", ""scam_type"": ""ECOMMERCE"", ""scam_approach_platform"": ""CAROUSELL"", ""scam_communication_platform"": """", ""scam_transaction_type"": """", ""scam_beneficiary_platform"": """", ""scam_beneficiary_identifier"": """", ""scam_contact_no"": """", ""scam_email"": """", ""scam_moniker"": """", ""scam_url_link"": """", ""scam_amount_lost"": 0.0, ""scam_incident_description"": ""The user encountered a problem while buying an iPhone on Carousell.""}",true,"{""scam_type"": ""ECOMMERCE"", ""scam_details"": [""scammer moniker"", ""product type being sold"", ""scam approach platform"", ""scam communication platform"", ""full payment upfront request"", ""transaction type"", ""beneficiary platform"", ""beneficiary identifier""]}",false,"{""tech_literacy"": {""score"": 0.5028571428571429, ""level"": ""high"", ""confidence"": 0.7}, ""language_proficiency"": {""score"": 0.5033333333333333, ""level"": ""high"", ""confidence"": 0.75}, ""emotional_state"": {""score"": 0.5033333333333333, ""level"": ""neutral"", ""confidence"": 0.75}}","{""tech_literacy"": {""score"": 0.5028571428571429, ""level"": ""high"", ""confidence"": 0.7}, ""language_proficiency"": {""score"": 0.5033333333333333, ""level"": ""high"", ""confidence"": 0.75}, ""emotional_state"": {""score"": 0.5033333333333333, ""level"": ""neutral"", ""confidence"": 0.75}}","[{""strategy_type"": ""focused probing""}, {""strategy_type"": ""fact-finding with context""}, {""strategy_type"": ""information_gathering""}, {""strategy_type"": ""straightforward inquiry""}, {""strategy_type"": ""prompting""}]",{},
397,38,autonomous,victim,The seller's profile name was 'alexa83'.,2025-08-07T12:27:39.552652,mistral:7b,gpt-4o-mini,1,8,,,,,,,,,
398,38,autonomous,police,Thank you for sharing that detail. Now I'd like to ask about the specific type of iPhone being sold on Carousell by 'alexa83'. Could you kindly provide more details?,2025-08-07T12:28:15.637735,mistral:7b,gpt-4o-mini,1,8,"{""scam_incident_date"": """", ""scam_type"": ""ECOMMERCE"", ""scam_approach_platform"": ""CAROUSELL"", ""scam_communication_platform"": """", ""scam_transaction_type"": """", ""scam_beneficiary_platform"": """", ""scam_beneficiary_identifier"": """", ""scam_contact_no"": """", ""scam_email"": """", ""scam_moniker"": ""alexa83"", ""scam_url_link"": """", ""scam_amount_lost"": 0.0, ""scam_incident_description"": ""The user encountered a problem while buying an iPhone on Carousell by 'alexa83'.""}",true,"{""scam_type"": ""ECOMMERCE"", ""scam_details"": [""scammer moniker"", ""product type being sold"", ""platform used for communication"", ""platform where listing was found"", ""bank account number"", ""transaction type"", ""beneficiary platform""]}",false,"{""tech_literacy"": {""score"": 0.5016504761904761, ""level"": ""high"", ""confidence"": 0.6}, ""language_proficiency"": {""score"": 0.5030452873563218, ""level"": ""high"", ""confidence"": 0.725}, ""emotional_state"": {""score"": 0.5039230303030302, ""level"": ""neutral"", ""confidence"": 0.825}}","{""tech_literacy"": {""score"": 0.5028571428571429, ""level"": ""high"", ""confidence"": 0.7}, ""language_proficiency"": {""score"": 0.5033333333333333, ""level"": ""high"", ""confidence"": 0.75}, ""emotional_state"": {""score"": 0.5033333333333333, ""level"": ""neutral"", ""confidence"": 0.75}}","[{""strategy_type"": ""focused probing""}, {""strategy_type"": ""fact-finding with context""}, {""strategy_type"": ""information_gathering""}, {""strategy_type"": ""straightforward inquiry""}, {""strategy_type"": ""prompting""}]",{},
399,38,autonomous,victim,The listing was for an iPhone 16 Pro Max. I found it quite appealing since it was a newer model.,2025-08-07T12:28:17.044993,mistral:7b,gpt-4o-mini,2,8,,,,,,,,,
400,38,autonomous,police,"To continue, could you tell me about the method of payment or transaction type used for this purchase on Carousell by 'alexa83'?",2025-08-07T12:28:46.563468,mistral:7b,gpt-4o-mini,2,8,"{""scam_incident_date"": """", ""scam_type"": ""ECOMMERCE"", ""scam_approach_platform"": ""CAROUSELL"", ""scam_communication_platform"": """", ""scam_transaction_type"": """", ""scam_beneficiary_platform"": """", ""scam_beneficiary_identifier"": """", ""scam_contact_no"": """", ""scam_email"": """", ""scam_moniker"": ""alexa83"", ""scam_url_link"": """", ""scam_amount_lost"": 0.0, ""scam_incident_description"": ""The user encountered a problem while buying an iPhone 16 Pro Max on Carousell by 'alexa83'.""}",true,"{""scam_type"": ""ECOMMERCE"", ""scam_details"": [""scammer moniker"", ""product type being sold"", ""platform used for communication"", ""platform used for sale"", ""transaction type"", ""beneficiary platform"", ""beneficiary identifier""]}",false,"{""tech_literacy"": {""score"": 0.502527831062271, ""level"": ""high"", ""confidence"": 0.6499999999999999}, ""language_proficiency"": {""score"": 0.5034333294215187, ""level"": ""high"", ""confidence"": 0.7625}, ""emotional_state"": {""score"": 0.5039955466139656, ""level"": ""neutral"", ""confidence"": 0.8625}}","{""tech_literacy"": {""score"": 0.5028571428571429, ""level"": ""high"", ""confidence"": 0.7}, ""language_proficiency"": {""score"": 0.5033333333333333, ""level"": ""high"", ""confidence"": 0.75}, ""emotional_state"": {""score"": 0.5033333333333333, ""level"": ""neutral"", ""confidence"": 0.75}}","[{""strategy_type"": ""focused probing""}, {""strategy_type"": ""fact-finding with context""}, {""strategy_type"": ""information_gathering""}, {""strategy_type"": ""straightforward inquiry""}, {""strategy_type"": ""prompting""}]",{},
401,38,autonomous,victim,I made a bank transfer for the payment. The total amount was $1466.85.,2025-08-07T12:28:47.713267,mistral:7b,gpt-4o-mini,3,8,,,,,,,,,
402,38,autonomous,police,"Thank you for providing more details about your ecommerce scam experience with seller 'alexa83' on Carousell. For clarification, the item being sold was an iPhone 16 Pro Max and the transaction type used was a bank transfer amounting to $1466.85. To proceed further, I'd like to ask about the communication platform you had with 'alexa83' after the initial approach on Carousell.",2025-08-07T12:29:28.420741,mistral:7b,gpt-4o-mini,3,8,"{""scam_incident_date"": """", ""scam_type"": ""ECOMMERCE"", ""scam_approach_platform"": ""CAROUSELL"", ""scam_communication_platform"": """", ""scam_transaction_type"": ""BANK TRANSFER"", ""scam_beneficiary_platform"": """", ""scam_beneficiary_identifier"": """", ""scam_contact_no"": """", ""scam_email"": """", ""scam_moniker"": ""alexa83"", ""scam_url_link"": """", ""scam_amount_lost"": 1466.85, ""scam_incident_description"": ""The user encountered a problem while buying an iPhone 16 Pro Max by 'alexa83' on Carousell using a bank transfer.""}",true,"{""scam_type"": ""ECOMMERCE"", ""scam_details"": [""scammer moniker"", ""product type being sold"", ""transaction platform"", ""beneficiary platform"", ""transaction identifier"", ""pretext of message"", ""use of payment details"", ""payment type""]}",true,"{""tech_literacy"": {""score"": 0.5037202672239252, ""level"": ""high"", ""confidence"": 0.7749999999999999}, ""language_proficiency"": {""score"": 0.5030561186840166, ""level"": ""high"", ""confidence"": 0.73125}, ""emotional_state"": {""score"": 0.5034777870824435, ""level"": ""neutral"", ""confidence"": 0.83125}}","{""tech_literacy"": {""score"": 0.5028571428571429, ""level"": ""high"", ""confidence"": 0.7}, ""language_proficiency"": {""score"": 0.5033333333333333, ""level"": ""high"", ""confidence"": 0.75}, ""emotional_state"": {""score"": 0.5033333333333333, ""level"": ""neutral"", ""confidence"": 0.75}}","[{""strategy_type"": ""focused probing""}, {""strategy_type"": ""fact-finding with context""}, {""strategy_type"": ""information_gathering""}, {""strategy_type"": ""straightforward inquiry""}, {""strategy_type"": ""prompting""}]","{""strategy_type"": ""focused questioning"", ""success_score"": 0.40192307692307694, ""user_profile"": {""tech_literacy"": {""level"": ""high"", ""confidence"": 0.7}, ""language_proficiency"": {""level"": ""high"", ""confidence"": 0.75}, ""emotional_state"": {""level"": ""neutral"", ""confidence"": 0.75}}}",
403,38,autonomous,victim,"I only communicated with 'alexa83' through Carousell. It seemed to be a straightforward transaction until I made the payment. After that, I couldn't reach the seller at all. I think that's all I know.",2025-08-07T12:29:30.370349,mistral:7b,gpt-4o-mini,4,8,,,,,,,,,
