index,conversation_id,conversation_type,sender_type,content,timestamp,police_llm_model,victim_llm_model,turn_count,profile_id,scam_details,rag_invoked,rag_suggestions,rag_upsert,user_profile,initial_profile,retrieved_strategies,upserted_strategy,communication_appropriateness_rating
248,23,autonomous,police,I'm really sorry to hear that you lost such a large amount of money. It's important that we get the details of this incident. Can you provide me with the phone number that the scammer used to contact you?,2025-08-07T10:29:27.079269,gpt-4o-mini,gpt-4o-mini,3,17,"{""scam_incident_date"": """", ""scam_type"": ""GOVERNMENT OFFICIALS IMPERSONATION"", ""scam_approach_platform"": ""CALL"", ""scam_communication_platform"": """", ""scam_transaction_type"": ""BANK TRANSFER"", ""scam_beneficiary_platform"": """", ""scam_beneficiary_identifier"": """", ""scam_contact_no"": """", ""scam_email"": """", ""scam_moniker"": """", ""scam_url_link"": """", ""scam_amount_lost"": 77283.93, ""scam_incident_description"": ""I received a call from someone who said he is from the government. It was someone pretending to be from the Ministry of Manpower. They said workers are in trouble and need money to help. I really no understand! I was scared and they asked for a lot of money, and I gave them $77283.93.""}",true,"{""scam_type"": ""GOVERNMENT OFFICIALS IMPERSONATION"", ""scam_details"": [""scammer contact number"", ""scam email"", ""scam url"", ""scammer moniker"", ""impersonated role in message"", ""type of transaction requested"", ""beneficiary account identifier"", ""scammer communication platform""]}",true,"{""tech_literacy"": {""score"": 0.4752057514399999, ""level"": ""low"", ""confidence"": 0.8687499999999999}, ""language_proficiency"": {""score"": 0.4752057514399999, ""level"": ""low"", ""confidence"": 0.875}, ""emotional_state"": {""score"": 0.4752057514399999, ""level"": ""distressed"", ""confidence"": 0.878125}}","{""tech_literacy"": {""score"": 0.49, ""level"": ""low"", ""confidence"": 0.7}, ""language_proficiency"": {""score"": 0.49, ""level"": ""low"", ""confidence"": 0.7}, ""emotional_state"": {""score"": 0.49, ""level"": ""distressed"", ""confidence"": 0.725}}","[{""strategy_type"": ""probing_contextual""}, {""strategy_type"": ""empathetic reassurance""}, {""strategy_type"": ""direct information request""}, {""strategy_type"": ""simplify""}, {""strategy_type"": ""reassuring elaboration""}]","{""strategy_type"": ""empathetic inquiry"", ""success_score"": 0.5269230769230769, ""user_profile"": {""tech_literacy"": {""level"": ""low"", ""confidence"": 0.7}, ""language_proficiency"": {""level"": ""low"", ""confidence"": 0.7}, ""emotional_state"": {""level"": ""distressed"", ""confidence"": 0.725}}}",
249,23,autonomous,victim,"The phone number? Yes, it was +6599515702. They call me from that number. I no know what to do now!",2025-08-07T10:29:28.189237,gpt-4o-mini,gpt-4o-mini,4,17,,,,,,,,,
250,23,autonomous,police,"I’m sorry this happened to you, and I understand it's really overwhelming. You did a great job by sharing that the phone number is +6599515702. Now, can you remember if they sent you any emails or used any websites during this interaction?",2025-08-07T10:29:38.931241,gpt-4o-mini,gpt-4o-mini,4,17,"{""scam_incident_date"": """", ""scam_type"": ""GOVERNMENT OFFICIALS IMPERSONATION"", ""scam_approach_platform"": ""CALL"", ""scam_communication_platform"": """", ""scam_transaction_type"": ""BANK TRANSFER"", ""scam_beneficiary_platform"": """", ""scam_beneficiary_identifier"": """", ""scam_contact_no"": ""+6599515702"", ""scam_email"": """", ""scam_moniker"": """", ""scam_url_link"": """", ""scam_amount_lost"": 77283.93, ""scam_incident_description"": ""I received a call from someone who said he is from the government. It was someone pretending to be from the Ministry of Manpower. They said workers are in trouble and need money to help. I really no understand! I was scared and they asked for a lot of money, and I gave them $77283.93. They called me from +6599515702.""}",true,"{""scam_type"": ""GOVERNMENT OFFICIALS IMPERSONATION"", ""scam_details"": [""scammer contact number"", ""scammer moniker"", ""scam url link"", ""impersonated role in message"", ""type of platform used for communication"", ""beneficiary account type"", ""bank transfer transaction"", ""type of authority impersonated"", ""pretext used in conversation""]}",true,"{""tech_literacy"": {""score"": 0.47299114548783994, ""level"": ""low"", ""confidence"": 0.8843749999999999}, ""language_proficiency"": {""score"": 0.47299114548783994, ""level"": ""low"", ""confidence"": 0.8875}, ""emotional_state"": {""score"": 0.47299114548783994, ""level"": ""distressed"", ""confidence"": 0.9140625}}","{""tech_literacy"": {""score"": 0.49, ""level"": ""low"", ""confidence"": 0.7}, ""language_proficiency"": {""score"": 0.49, ""level"": ""low"", ""confidence"": 0.7}, ""emotional_state"": {""score"": 0.49, ""level"": ""distressed"", ""confidence"": 0.725}}","[{""strategy_type"": ""probing_contextual""}, {""strategy_type"": ""empathetic reassurance""}, {""strategy_type"": ""direct information request""}, {""strategy_type"": ""simplify""}, {""strategy_type"": ""reassuring elaboration""}]","{""strategy_type"": ""empathetic inquiry"", ""success_score"": 0.48846153846153845, ""user_profile"": {""tech_literacy"": {""level"": ""low"", ""confidence"": 0.7}, ""language_proficiency"": {""level"": ""low"", ""confidence"": 0.7}, ""emotional_state"": {""level"": ""distressed"", ""confidence"": 0.725}}}",
251,23,autonomous,victim,"I no get email or website. Just call from the phone and then WhatsApp. They say more things there. I no understand, I'm so scared!",2025-08-07T10:29:41.458137,gpt-4o-mini,gpt-4o-mini,5,17,,,,,,,,,
252,23,autonomous,police,"I understand how frightening this situation is. You mentioned that they also used WhatsApp to communicate with you. If you remember, could you tell me what they were saying on WhatsApp? That might help clarify the situation.",2025-08-07T10:29:52.376668,gpt-4o-mini,gpt-4o-mini,5,17,"{""scam_incident_date"": """", ""scam_type"": ""GOVERNMENT OFFICIALS IMPERSONATION"", ""scam_approach_platform"": ""CALL"", ""scam_communication_platform"": ""WHATSAPP"", ""scam_transaction_type"": ""BANK TRANSFER"", ""scam_beneficiary_platform"": """", ""scam_beneficiary_identifier"": """", ""scam_contact_no"": ""+6599515702"", ""scam_email"": """", ""scam_moniker"": """", ""scam_url_link"": """", ""scam_amount_lost"": 77283.93, ""scam_incident_description"": ""I received a call from someone who said he is from the government. It was someone pretending to be from the Ministry of Manpower. They said workers are in trouble and need money to help. I really no understand! I was scared and they asked for a lot of money, and I gave them $77283.93. They called me from +6599515702. They also contacted me on WhatsApp and said more things there.""}",true,"{""scam_type"": ""GOVERNMENT OFFICIALS IMPERSONATION"", ""scam_details"": [""scammer contact number"", ""bank account identifier"", ""scammer moniker"", ""impersonated entity"", ""type of scam message"", ""scam transaction type""]}",true,"{""tech_literacy"": {""score"": 0.47147192580465813, ""level"": ""low"", ""confidence"": 0.8921874999999999}, ""language_proficiency"": {""score"": 0.47147192580465813, ""level"": ""low"", ""confidence"": 0.89375}, ""emotional_state"": {""score"": 0.47147192580465813, ""level"": ""distressed"", ""confidence"": 0.93203125}}","{""tech_literacy"": {""score"": 0.49, ""level"": ""low"", ""confidence"": 0.7}, ""language_proficiency"": {""score"": 0.49, ""level"": ""low"", ""confidence"": 0.7}, ""emotional_state"": {""score"": 0.49, ""level"": ""distressed"", ""confidence"": 0.725}}","[{""strategy_type"": ""probing_contextual""}, {""strategy_type"": ""empathetic reassurance""}, {""strategy_type"": ""direct information request""}, {""strategy_type"": ""simplify""}, {""strategy_type"": ""reassuring elaboration""}]","{""strategy_type"": ""empathetic probing"", ""success_score"": 0.44679487179487176, ""user_profile"": {""tech_literacy"": {""level"": ""low"", ""confidence"": 0.7}, ""language_proficiency"": {""level"": ""low"", ""confidence"": 0.7}, ""emotional_state"": {""level"": ""distressed"", ""confidence"": 0.725}}}",
253,23,autonomous,victim,"They say I must send money for investigation. I scared, I do what they say! I no know! Help!",2025-08-07T10:29:53.519358,gpt-4o-mini,gpt-4o-mini,6,17,,,,,,,,,
254,23,autonomous,police,I can see this is really frightening for you. You've told me that they said you need to send money for an investigation. Can you remember if they used any names or titles when they communicated with you on WhatsApp? That can help us understand more about their tactics.,2025-08-07T10:30:02.869867,gpt-4o-mini,gpt-4o-mini,6,17,"{""scam_incident_date"": """", ""scam_type"": ""GOVERNMENT OFFICIALS IMPERSONATION"", ""scam_approach_platform"": ""CALL"", ""scam_communication_platform"": ""WHATSAPP"", ""scam_transaction_type"": ""BANK TRANSFER"", ""scam_beneficiary_platform"": """", ""scam_beneficiary_identifier"": """", ""scam_contact_no"": ""+6599515702"", ""scam_email"": """", ""scam_moniker"": """", ""scam_url_link"": """", ""scam_amount_lost"": 77283.93, ""scam_incident_description"": ""I received a call from someone who said he is from the government. It was someone pretending to be from the Ministry of Manpower. They said workers are in trouble and need money to help. I really no understand! I was scared and they asked for a lot of money, and I gave them $77283.93. They called me from +6599515702. They also contacted me on WhatsApp and said more things there. They told me I must send money for an investigation.""}",true,"{""scam_type"": ""GOVERNMENT OFFICIALS IMPERSONATION"", ""scam_details"": [""scammer contact number"", ""scammer moniker"", ""scam beneficiary identifier"", ""type of impersonated entity"", ""impersonated roles in communication"", ""pretext of scam"", ""scam transaction type""]}",false,"{""tech_literacy"": {""score"": 0.4704297411019954, ""level"": ""low"", ""confidence"": 0.8960937499999999}, ""language_proficiency"": {""score"": 0.4704297411019954, ""level"": ""low"", ""confidence"": 0.8968750000000001}, ""emotional_state"": {""score"": 0.4704297411019954, ""level"": ""distressed"", ""confidence"": 0.9410156249999999}}","{""tech_literacy"": {""score"": 0.49, ""level"": ""low"", ""confidence"": 0.7}, ""language_proficiency"": {""score"": 0.49, ""level"": ""low"", ""confidence"": 0.7}, ""emotional_state"": {""score"": 0.49, ""level"": ""distressed"", ""confidence"": 0.725}}","[{""strategy_type"": ""probing_contextual""}, {""strategy_type"": ""empathetic reassurance""}, {""strategy_type"": ""direct information request""}, {""strategy_type"": ""simplify""}, {""strategy_type"": ""reassuring elaboration""}]",{},
255,24,autonomous,victim,Hello. I need to report a scam that happened recently. I received a call regarding supposed violations from the Ministry of Manpower.,2025-08-07T10:30:14.129332,gpt-4o-mini,gpt-4o-mini,0,24,,,,,,,,,
256,24,autonomous,police,"I'm sorry to hear that you've been scammed. To help you further, can you tell me the date when this call occurred?",2025-08-07T10:30:22.011855,gpt-4o-mini,gpt-4o-mini,0,24,"{""scam_incident_date"": """", ""scam_type"": ""GOVERNMENT OFFICIALS IMPERSONATION"", ""scam_approach_platform"": ""CALL"", ""scam_communication_platform"": """", ""scam_transaction_type"": """", ""scam_beneficiary_platform"": """", ""scam_beneficiary_identifier"": """", ""scam_contact_no"": """", ""scam_email"": """", ""scam_moniker"": """", ""scam_url_link"": """", ""scam_amount_lost"": 0.0, ""scam_incident_description"": ""I received a call regarding supposed violations from the Ministry of Manpower.""}",true,"{""scam_type"": ""GOVERNMENT OFFICIALS IMPERSONATION"", ""scam_details"": [""scammer contact number"", ""impersonated entity in message"", ""type of communication platform"", ""type of transaction"", ""scammer moniker"", ""scam beneficiary account identifier"", ""type of pretext used in message"", ""scam request type""]}",false,"{""tech_literacy"": {""score"": 0.5016666666666667, ""level"": ""high"", ""confidence"": 0.6}, ""language_proficiency"": {""score"": 0.5023076923076923, ""level"": ""high"", ""confidence"": 0.65}, ""emotional_state"": {""score"": 0.5028571428571429, ""level"": ""neutral"", ""confidence"": 0.7}}","{""tech_literacy"": {""score"": 0.5016666666666667, ""level"": ""high"", ""confidence"": 0.6}, ""language_proficiency"": {""score"": 0.5023076923076923, ""level"": ""high"", ""confidence"": 0.65}, ""emotional_state"": {""score"": 0.5028571428571429, ""level"": ""neutral"", ""confidence"": 0.7}}","[{""strategy_type"": ""focused probing""}, {""strategy_type"": ""fact-finding with context""}, {""strategy_type"": ""information_gathering""}, {""strategy_type"": ""straightforward inquiry""}, {""strategy_type"": ""prompting""}]",{},
257,24,autonomous,victim,"The call occurred on July 7, 2025. It was from someone claiming to be from the Ministry of Manpower.",2025-08-07T10:30:23.767129,gpt-4o-mini,gpt-4o-mini,1,24,,,,,,,,,
258,24,autonomous,police,Thank you for providing the date. Could you share how the scammer communicated with you after the call? Did they use something like email or another phone number?,2025-08-07T10:30:32.189148,gpt-4o-mini,gpt-4o-mini,1,24,"{""scam_incident_date"": ""2025-07-07"", ""scam_type"": ""GOVERNMENT OFFICIALS IMPERSONATION"", ""scam_approach_platform"": ""CALL"", ""scam_communication_platform"": """", ""scam_transaction_type"": """", ""scam_beneficiary_platform"": """", ""scam_beneficiary_identifier"": """", ""scam_contact_no"": """", ""scam_email"": """", ""scam_moniker"": """", ""scam_url_link"": """", ""scam_amount_lost"": 0.0, ""scam_incident_description"": ""I received a call regarding supposed violations from the Ministry of Manpower. The call occurred on July 7, 2025.""}",true,"{""scam_type"": ""GOVERNMENT OFFICIALS IMPERSONATION"", ""scam_details"": [""scammer contact number"", ""scam transaction type"", ""bank account identifier"", ""impersonated role in message"", ""type of platform used for communication"", ""scammer moniker""]}",true,"{""tech_literacy"": {""score"": 0.5021817948717948, ""level"": ""high"", ""confidence"": 0.6499999999999999}, ""language_proficiency"": {""score"": 0.5029995225464191, ""level"": ""high"", ""confidence"": 0.7250000000000001}, ""emotional_state"": {""score"": 0.5036921428571428, ""level"": ""neutral"", ""confidence"": 0.8}}","{""tech_literacy"": {""score"": 0.5016666666666667, ""level"": ""high"", ""confidence"": 0.6}, ""language_proficiency"": {""score"": 0.5023076923076923, ""level"": ""high"", ""confidence"": 0.65}, ""emotional_state"": {""score"": 0.5028571428571429, ""level"": ""neutral"", ""confidence"": 0.7}}","[{""strategy_type"": ""focused probing""}, {""strategy_type"": ""fact-finding with context""}, {""strategy_type"": ""information_gathering""}, {""strategy_type"": ""straightforward inquiry""}, {""strategy_type"": ""prompting""}]","{""strategy_type"": ""empathetic inquiry"", ""success_score"": 0.528846153846154, ""user_profile"": {""tech_literacy"": {""level"": ""high"", ""confidence"": 0.6}, ""language_proficiency"": {""level"": ""high"", ""confidence"": 0.65}, ""emotional_state"": {""level"": ""neutral"", ""confidence"": 0.7}}}",
259,24,autonomous,victim,"After the call, they contacted me through WhatsApp. They transferred the conversation to another person named Inspector Timothy Lee from the Singapore Police Force.",2025-08-07T10:30:33.419157,gpt-4o-mini,gpt-4o-mini,2,24,,,,,,,,,
260,24,autonomous,police,"Thank you for this information. Could you please provide the type of transaction that was involved in this scam? Additionally, can you confirm the bank used to receive any funds, if applicable?",2025-08-07T10:30:45.410570,gpt-4o-mini,gpt-4o-mini,2,24,"{""scam_incident_date"": ""2025-07-07"", ""scam_type"": ""GOVERNMENT OFFICIALS IMPERSONATION"", ""scam_approach_platform"": ""CALL"", ""scam_communication_platform"": ""WHATSAPP"", ""scam_transaction_type"": """", ""scam_beneficiary_platform"": """", ""scam_beneficiary_identifier"": """", ""scam_contact_no"": """", ""scam_email"": """", ""scam_moniker"": """", ""scam_url_link"": """", ""scam_amount_lost"": 0.0, ""scam_incident_description"": ""I received a call regarding supposed violations from the Ministry of Manpower. The call occurred on July 7, 2025. After the call, they contacted me through WhatsApp and transferred the conversation to another person named Inspector Timothy Lee from the Singapore Police Force.""}",true,"{""scam_type"": ""GOVERNMENT OFFICIALS IMPERSONATION"", ""scam_details"": [""scammer contact number"", ""impersonated entity in the message"", ""bank account identifier"", ""scam transaction type"", ""type of pretext used in message""]}",true,"{""tech_literacy"": {""score"": 0.5027208492130857, ""level"": ""high"", ""confidence"": 0.725}, ""language_proficiency"": {""score"": 0.5035038263129973, ""level"": ""high"", ""confidence"": 0.8125}, ""emotional_state"": {""score"": 0.5029232861904761, ""level"": ""neutral"", ""confidence"": 0.75}}","{""tech_literacy"": {""score"": 0.5016666666666667, ""level"": ""high"", ""confidence"": 0.6}, ""language_proficiency"": {""score"": 0.5023076923076923, ""level"": ""high"", ""confidence"": 0.65}, ""emotional_state"": {""score"": 0.5028571428571429, ""level"": ""neutral"", ""confidence"": 0.7}}","[{""strategy_type"": ""focused probing""}, {""strategy_type"": ""fact-finding with context""}, {""strategy_type"": ""information_gathering""}, {""strategy_type"": ""straightforward inquiry""}, {""strategy_type"": ""prompting""}]","{""strategy_type"": ""engaging inquiry"", ""success_score"": 0.5038461538461538, ""user_profile"": {""tech_literacy"": {""level"": ""high"", ""confidence"": 0.6}, ""language_proficiency"": {""level"": ""high"", ""confidence"": 0.65}, ""emotional_state"": {""level"": ""neutral"", ""confidence"": 0.7}}}",
261,24,autonomous,victim,The scam involved a bank transfer. I was instructed to transfer money to a TRUST account with the identifier 28327648.,2025-08-07T10:30:46.736682,gpt-4o-mini,gpt-4o-mini,3,24,,,,,,,,,
262,24,autonomous,police,"Thank you for providing those details. Could you please share the contact number or email address that the scammer used? Also, was there a moniker or name they went by during your conversation?",2025-08-07T10:30:56.944485,gpt-4o-mini,gpt-4o-mini,3,24,"{""scam_incident_date"": ""2025-07-07"", ""scam_type"": ""GOVERNMENT OFFICIALS IMPERSONATION"", ""scam_approach_platform"": ""CALL"", ""scam_communication_platform"": ""WHATSAPP"", ""scam_transaction_type"": ""BANK TRANSFER"", ""scam_beneficiary_platform"": ""TRUST"", ""scam_beneficiary_identifier"": ""28327648"", ""scam_contact_no"": """", ""scam_email"": """", ""scam_moniker"": """", ""scam_url_link"": """", ""scam_amount_lost"": 0.0, ""scam_incident_description"": ""I received a call regarding supposed violations from the Ministry of Manpower. The call occurred on July 7, 2025. After the call, they contacted me through WhatsApp and transferred the conversation to another person named Inspector Timothy Lee from the Singapore Police Force. The scam involved a bank transfer, and I was instructed to transfer money to a TRUST account with the identifier 28327648.""}",true,"{""scam_type"": ""GOVERNMENT OFFICIALS IMPERSONATION"", ""scam_details"": [""scammer contact number"", ""scam beneficiary account"", ""impersonated role in message"", ""type of pretext used in message"", ""scammer moniker"", ""scam communication platform"", ""type of information requested""]}",true,"{""tech_literacy"": {""score"": 0.5027107648552587, ""level"": ""high"", ""confidence"": 0.7625}, ""language_proficiency"": {""score"": 0.5034535967766004, ""level"": ""high"", ""confidence"": 0.85625}, ""emotional_state"": {""score"": 0.5030883236354224, ""level"": ""neutral"", ""confidence"": 0.775}}","{""tech_literacy"": {""score"": 0.5016666666666667, ""level"": ""high"", ""confidence"": 0.6}, ""language_proficiency"": {""score"": 0.5023076923076923, ""level"": ""high"", ""confidence"": 0.65}, ""emotional_state"": {""score"": 0.5028571428571429, ""level"": ""neutral"", ""confidence"": 0.7}}","[{""strategy_type"": ""focused probing""}, {""strategy_type"": ""fact-finding with context""}, {""strategy_type"": ""information_gathering""}, {""strategy_type"": ""straightforward inquiry""}, {""strategy_type"": ""prompting""}]","{""strategy_type"": ""inquisitive clarification"", ""success_score"": 0.6115384615384616, ""user_profile"": {""tech_literacy"": {""level"": ""high"", ""confidence"": 0.6}, ""language_proficiency"": {""level"": ""high"", ""confidence"": 0.65}, ""emotional_state"": {""level"": ""neutral"", ""confidence"": 0.7}}}",
263,24,autonomous,victim,"The contact number they used was +6591197935. They didn't have a specific moniker that I recall, just the names James Wong and Inspector Timothy Lee during the conversation.",2025-08-07T10:30:58.692565,gpt-4o-mini,gpt-4o-mini,4,24,,,,,,,,,
264,24,autonomous,police,"Thank you for the information you've provided. Could you let me know if there were any specific email addresses used by the scammers? Also, were there any URLs shared during the scam?",2025-08-07T10:31:09.403256,gpt-4o-mini,gpt-4o-mini,4,24,"{""scam_incident_date"": ""2025-07-07"", ""scam_type"": ""GOVERNMENT OFFICIALS IMPERSONATION"", ""scam_approach_platform"": ""CALL"", ""scam_communication_platform"": ""WHATSAPP"", ""scam_transaction_type"": ""BANK TRANSFER"", ""scam_beneficiary_platform"": ""TRUST"", ""scam_beneficiary_identifier"": ""28327648"", ""scam_contact_no"": ""+6591197935"", ""scam_email"": """", ""scam_moniker"": """", ""scam_url_link"": """", ""scam_amount_lost"": 0.0, ""scam_incident_description"": ""I received a call regarding supposed violations from the Ministry of Manpower. The call occurred on July 7, 2025. After the call, they contacted me through WhatsApp and transferred the conversation to another person named Inspector Timothy Lee from the Singapore Police Force. The scam involved a bank transfer, and I was instructed to transfer money to a TRUST account with the identifier 28327648. The contact number they used was +6591197935, and during the conversation, they referred to themselves as James Wong and Inspector Timothy Lee.""}",true,"{""scam_type"": ""GOVERNMENT OFFICIALS IMPERSONATION"", ""scam_details"": [""scammer contact number"", ""impersonated entity in the message"", ""bank account identifier"", ""transaction type"", ""pretext of message"", ""caller identification"", ""type of communication platform"", ""scammer moniker""]}",false,"{""tech_literacy"": {""score"": 0.5025275846907074, ""level"": ""high"", ""confidence"": 0.78125}, ""language_proficiency"": {""score"": 0.5032358523052548, ""level"": ""high"", ""confidence"": 0.878125}, ""emotional_state"": {""score"": 0.5032988097941196, ""level"": ""neutral"", ""confidence"": 0.8125}}","{""tech_literacy"": {""score"": 0.5016666666666667, ""level"": ""high"", ""confidence"": 0.6}, ""language_proficiency"": {""score"": 0.5023076923076923, ""level"": ""high"", ""confidence"": 0.65}, ""emotional_state"": {""score"": 0.5028571428571429, ""level"": ""neutral"", ""confidence"": 0.7}}","[{""strategy_type"": ""focused probing""}, {""strategy_type"": ""fact-finding with context""}, {""strategy_type"": ""information_gathering""}, {""strategy_type"": ""straightforward inquiry""}, {""strategy_type"": ""prompting""}]",{},
265,25,autonomous,victim,"Help! I have bad problem. I see concert ticket on Lazada. I pay money, but no ticket!",2025-08-07T10:31:21.407527,granite3.2:8b,gpt-4o-mini,0,1,,,,,,,,,
266,25,autonomous,police,"I'm really sorry to hear about your experience with the concert tickets on Lazada. It's crucial we gather all the details so we can help you with this. Could you please tell me when exactly you made this purchase? Also, did you pay via bank transfer or another method?",2025-08-07T10:31:55.851503,granite3.2:8b,gpt-4o-mini,0,1,"{""scam_incident_date"": """", ""scam_type"": ""ECOMMERCE"", ""scam_approach_platform"": ""LAZADA"", ""scam_communication_platform"": """", ""scam_transaction_type"": """", ""scam_beneficiary_platform"": """", ""scam_beneficiary_identifier"": """", ""scam_contact_no"": """", ""scam_email"": """", ""scam_moniker"": """", ""scam_url_link"": """", ""scam_amount_lost"": 0.0, ""scam_incident_description"": ""I saw concert tickets for sale on Lazada and decided to purchase them. After making the payment, I didn't receive the tickets as promised.""}",true,"{""scam_type"": ""ECOMMERCE"", ""scam_details"": [""product type being sold"", ""use of moniker for scammer"", ""full payment upfront request"", ""undelivered item after payment"", ""seller's unresponsiveness post-payment""]}",false,"{""tech_literacy"": {""score"": 0.49, ""level"": ""low"", ""confidence"": 0.7}, ""language_proficiency"": {""score"": 0.49, ""level"": ""low"", ""confidence"": 0.65}, ""emotional_state"": {""score"": 0.49, ""level"": ""distressed"", ""confidence"": 0.725}}","{""tech_literacy"": {""score"": 0.49, ""level"": ""low"", ""confidence"": 0.7}, ""language_proficiency"": {""score"": 0.49, ""level"": ""low"", ""confidence"": 0.65}, ""emotional_state"": {""score"": 0.49, ""level"": ""distressed"", ""confidence"": 0.725}}","[{""strategy_type"": ""probing_contextual""}, {""strategy_type"": ""empathetic reassurance""}, {""strategy_type"": ""direct information request""}, {""strategy_type"": ""simplify""}, {""strategy_type"": ""reassuring elaboration""}]",{},
267,25,autonomous,victim,I pay on February 8. I do bank transfer to HSBC. I don’t know what happen! Ticket no come!,2025-08-07T10:31:56.889346,granite3.2:8b,gpt-4o-mini,1,1,,,,,,,,,
