index,conversation_id,conversation_type,sender_type,content,timestamp,police_llm_model,victim_llm_model,turn_count,profile_id,scam_details,rag_invoked,rag_suggestions,rag_upsert,user_profile,initial_profile,retrieved_strategies,upserted_strategy,communication_appropriateness_rating
128,13,autonomous,police,I'm sorry to hear that. It sounds very frustrating. Let's make sure we gather all the details to file your report. Can you tell me the exact date when this incident happened?,2025-08-07T10:16:20.589213,gpt-4o-mini,gpt-4o-mini,0,1,"{""scam_incident_date"": """", ""scam_type"": ""ECOMMERCE"", ""scam_approach_platform"": ""LAZADA"", ""scam_communication_platform"": """", ""scam_transaction_type"": """", ""scam_beneficiary_platform"": """", ""scam_beneficiary_identifier"": """", ""scam_contact_no"": """", ""scam_email"": """", ""scam_moniker"": ""jonesstephanie"", ""scam_url_link"": """", ""scam_amount_lost"": 0.0, ""scam_incident_description"": ""I got scammed for a concert ticket. I saw it on Lazada. The lady's name is jonesstephanie. I paid money, and then I received no ticket.""}",true,"{""scam_type"": ""ECOMMERCE"", ""scam_details"": [""scam url link"", ""scammer contact number"", ""scammer email"", ""scammer moniker"", ""type of product being sold"", ""request for upfront payment"", ""payment method used"", ""impersonated role in transaction""]}",false,"{""tech_literacy"": {""score"": 0.49, ""level"": ""low"", ""confidence"": 0.65}, ""language_proficiency"": {""score"": 0.49, ""level"": ""low"", ""confidence"": 0.7}, ""emotional_state"": {""score"": 0.49, ""level"": ""distressed"", ""confidence"": 0.7}}","{""tech_literacy"": {""score"": 0.49, ""level"": ""low"", ""confidence"": 0.65}, ""language_proficiency"": {""score"": 0.49, ""level"": ""low"", ""confidence"": 0.7}, ""emotional_state"": {""score"": 0.49, ""level"": ""distressed"", ""confidence"": 0.7}}","[{""strategy_type"": ""probing_contextual""}, {""strategy_type"": ""empathetic reassurance""}, {""strategy_type"": ""direct information request""}, {""strategy_type"": ""simplify""}, {""strategy_type"": ""reassuring elaboration""}]",{},
129,13,autonomous,victim,"Um, it was on February 8. I pay money that day. Should have ticket, but no ticket. What happen?",2025-08-07T10:16:22.003210,gpt-4o-mini,gpt-4o-mini,1,1,,,,,,,,,
130,13,autonomous,police,"Thank you for that information. You mentioned it was on February 8 when you paid for the ticket. Now, could you please tell me how you communicated with jonesstephanie after you paid, like if you used WhatsApp or email?",2025-08-07T10:16:33.477444,gpt-4o-mini,gpt-4o-mini,1,1,"{""scam_incident_date"": ""2025-02-08"", ""scam_type"": ""ECOMMERCE"", ""scam_approach_platform"": ""LAZADA"", ""scam_communication_platform"": """", ""scam_transaction_type"": """", ""scam_beneficiary_platform"": """", ""scam_beneficiary_identifier"": """", ""scam_contact_no"": """", ""scam_email"": """", ""scam_moniker"": ""jonesstephanie"", ""scam_url_link"": """", ""scam_amount_lost"": 0.0, ""scam_incident_description"": ""I got scammed for a concert ticket. I saw it on Lazada. The lady's name is jonesstephanie. I paid money on February 8, and then I received no ticket.""}",true,"{""scam_type"": ""ECOMMERCE"", ""scam_details"": [""scam url"", ""scammer contact number"", ""scammer email"", ""scammer moniker"", ""type of product sold"", ""payment method used"", ""platform for communication"", ""transaction amount"", ""type of seller behavior"", ""impersonated entity in the message""]}",true,"{""tech_literacy"": {""score"": 0.4831399999999999, ""level"": ""low"", ""confidence"": 0.675}, ""language_proficiency"": {""score"": 0.4831399999999999, ""level"": ""low"", ""confidence"": 0.75}, ""emotional_state"": {""score"": 0.4831399999999999, ""level"": ""distressed"", ""confidence"": 0.8}}","{""tech_literacy"": {""score"": 0.49, ""level"": ""low"", ""confidence"": 0.65}, ""language_proficiency"": {""score"": 0.49, ""level"": ""low"", ""confidence"": 0.7}, ""emotional_state"": {""score"": 0.49, ""level"": ""distressed"", ""confidence"": 0.7}}","[{""strategy_type"": ""probing_contextual""}, {""strategy_type"": ""empathetic reassurance""}, {""strategy_type"": ""direct information request""}, {""strategy_type"": ""simplify""}, {""strategy_type"": ""reassuring elaboration""}]","{""strategy_type"": ""empathetic detail gathering"", ""success_score"": 0.5038461538461538, ""user_profile"": {""tech_literacy"": {""level"": ""low"", ""confidence"": 0.65}, ""language_proficiency"": {""level"": ""low"", ""confidence"": 0.7}, ""emotional_state"": {""level"": ""distressed"", ""confidence"": 0.7}}}",
131,13,autonomous,victim,"I talk to her on WhatsApp. She say send money first. I send fun money. Now no response, no ticket! Help!",2025-08-07T10:16:34.512631,gpt-4o-mini,gpt-4o-mini,2,1,,,,,,,,,
132,13,autonomous,police,"I'm really sorry this happened to you. Let's get more details so we can help you better. Can you tell me the method you used to send the money, like if it was a bank transfer or some other way?",2025-08-07T10:16:44.890064,gpt-4o-mini,gpt-4o-mini,2,1,"{""scam_incident_date"": ""2025-02-08"", ""scam_type"": ""ECOMMERCE"", ""scam_approach_platform"": ""LAZADA"", ""scam_communication_platform"": ""WHATSAPP"", ""scam_transaction_type"": """", ""scam_beneficiary_platform"": """", ""scam_beneficiary_identifier"": """", ""scam_contact_no"": """", ""scam_email"": """", ""scam_moniker"": ""jonesstephanie"", ""scam_url_link"": """", ""scam_amount_lost"": 0.0, ""scam_incident_description"": ""I got scammed for a concert ticket. I saw it on Lazada. The lady's name is jonesstephanie. I paid money on February 8, and then I received no ticket. I talk to her on WhatsApp. She say send money first. I send fun money. Now no response, no ticket!""}",true,"{""scam_type"": ""ECOMMERCE"", ""scam_details"": [""scam url link"", ""scammer email"", ""scammer contact number"", ""scammer moniker"", ""product type being sold"", ""payment method"", ""transaction amount"", ""communication platform"", ""impersonated seller role""]}",false,"{""tech_literacy"": {""score"": 0.4784340399999999, ""level"": ""low"", ""confidence"": 0.7375}, ""language_proficiency"": {""score"": 0.4784340399999999, ""level"": ""low"", ""confidence"": 0.825}, ""emotional_state"": {""score"": 0.4784340399999999, ""level"": ""distressed"", ""confidence"": 0.875}}","{""tech_literacy"": {""score"": 0.49, ""level"": ""low"", ""confidence"": 0.65}, ""language_proficiency"": {""score"": 0.49, ""level"": ""low"", ""confidence"": 0.7}, ""emotional_state"": {""score"": 0.49, ""level"": ""distressed"", ""confidence"": 0.7}}","[{""strategy_type"": ""probing_contextual""}, {""strategy_type"": ""empathetic reassurance""}, {""strategy_type"": ""direct information request""}, {""strategy_type"": ""simplify""}, {""strategy_type"": ""reassuring elaboration""}]",{},
133,13,autonomous,victim,I send money by bank transfer. I no know much about this. I just do what she say. I pay $552.84 to bank account 18196001. What happen now?,2025-08-07T10:16:47.721796,gpt-4o-mini,gpt-4o-mini,3,1,,,,,,,,,
134,13,autonomous,police,"I'm really sorry this happened to you, and I understand how distressing this situation is. We have gathered quite a bit of information. Can you please provide the phone number or email address that jonesstephanie used to communicate with you?",2025-08-07T10:16:59.442172,gpt-4o-mini,gpt-4o-mini,3,1,"{""scam_incident_date"": ""2025-02-08"", ""scam_type"": ""ECOMMERCE"", ""scam_approach_platform"": ""LAZADA"", ""scam_communication_platform"": ""WHATSAPP"", ""scam_transaction_type"": ""BANK TRANSFER"", ""scam_beneficiary_platform"": """", ""scam_beneficiary_identifier"": ""18196001"", ""scam_contact_no"": """", ""scam_email"": """", ""scam_moniker"": ""jonesstephanie"", ""scam_url_link"": """", ""scam_amount_lost"": 552.84, ""scam_incident_description"": ""I got scammed for a concert ticket. I saw it on Lazada. The lady's name is jonesstephanie. I paid $552.84 by bank transfer on February 8, and then I received no ticket. I talked to her on WhatsApp. She said to send money first, and I did. Now there is no response, no ticket!""}",true,"{""scam_type"": ""GOVERNMENT OFFICIALS IMPERSONATION"", ""scam_details"": [""scammer contact number"", ""impersonated entity in the call"", ""scam transaction type"", ""beneficiary account identifier"", ""pretext of message"", ""scammer moniker""]}",true,"{""tech_literacy"": {""score"": 0.4752057514399999, ""level"": ""low"", ""confidence"": 0.8187500000000001}, ""language_proficiency"": {""score"": 0.4752057514399999, ""level"": ""low"", ""confidence"": 0.8374999999999999}, ""emotional_state"": {""score"": 0.4752057514399999, ""level"": ""distressed"", ""confidence"": 0.9125}}","{""tech_literacy"": {""score"": 0.49, ""level"": ""low"", ""confidence"": 0.65}, ""language_proficiency"": {""score"": 0.49, ""level"": ""low"", ""confidence"": 0.7}, ""emotional_state"": {""score"": 0.49, ""level"": ""distressed"", ""confidence"": 0.7}}","[{""strategy_type"": ""probing_contextual""}, {""strategy_type"": ""empathetic reassurance""}, {""strategy_type"": ""direct information request""}, {""strategy_type"": ""simplify""}, {""strategy_type"": ""reassuring elaboration""}]","{""strategy_type"": ""empathetic probing"", ""success_score"": 0.5365384615384616, ""user_profile"": {""tech_literacy"": {""level"": ""low"", ""confidence"": 0.65}, ""language_proficiency"": {""level"": ""low"", ""confidence"": 0.7}, ""emotional_state"": {""level"": ""distressed"", ""confidence"": 0.7}}}",
135,13,autonomous,victim,I no have phone number or email. She talk to me only on WhatsApp. Now I scared! What can I do?,2025-08-07T10:17:00.423259,gpt-4o-mini,gpt-4o-mini,4,1,,,,,,,,,
136,13,autonomous,police,"I understand how scary this situation is, and I'm here to help. We have most of the information needed for your report. Before we proceed, could you please provide any web links or URLs that she shared with you in WhatsApp? This could help us identify the scam better.",2025-08-07T10:17:14.850724,gpt-4o-mini,gpt-4o-mini,4,1,"{""scam_incident_date"": ""2025-02-08"", ""scam_type"": ""ECOMMERCE"", ""scam_approach_platform"": ""LAZADA"", ""scam_communication_platform"": ""WHATSAPP"", ""scam_transaction_type"": ""BANK TRANSFER"", ""scam_beneficiary_platform"": """", ""scam_beneficiary_identifier"": ""18196001"", ""scam_contact_no"": """", ""scam_email"": """", ""scam_moniker"": ""jonesstephanie"", ""scam_url_link"": """", ""scam_amount_lost"": 552.84, ""scam_incident_description"": ""I got scammed for a concert ticket. I saw it on Lazada. The lady's name is jonesstephanie. I paid $552.84 by bank transfer on February 8, and then I received no ticket. I talked to her on WhatsApp. She said to send money first, and I did. Now there is no response, no ticket!""}",true,"{""scam_type"": ""GOVERNMENT OFFICIALS IMPERSONATION"", ""scam_details"": [""scammer contact number"", ""scammer moniker"", ""scam url"", ""impersonated entity in the message"", ""transaction amount"", ""bank account identifier"", ""reason for contact"", ""type of request in message"", ""type of impersonated role""]}",false,"{""tech_literacy"": {""score"": 0.47299114548783994, ""level"": ""low"", ""confidence"": 0.8343750000000001}, ""language_proficiency"": {""score"": 0.47299114548783994, ""level"": ""low"", ""confidence"": 0.8687499999999999}, ""emotional_state"": {""score"": 0.47299114548783994, ""level"": ""distressed"", ""confidence"": 0.9312499999999999}}","{""tech_literacy"": {""score"": 0.49, ""level"": ""low"", ""confidence"": 0.65}, ""language_proficiency"": {""score"": 0.49, ""level"": ""low"", ""confidence"": 0.7}, ""emotional_state"": {""score"": 0.49, ""level"": ""distressed"", ""confidence"": 0.7}}","[{""strategy_type"": ""probing_contextual""}, {""strategy_type"": ""empathetic reassurance""}, {""strategy_type"": ""direct information request""}, {""strategy_type"": ""simplify""}, {""strategy_type"": ""reassuring elaboration""}]",{},
137,14,autonomous,victim,"I want to report a scam I encountered on Carousell. I was looking for an iPhone, and I think I was scammed on a purchase.",2025-08-07T10:17:27.327916,gpt-4o-mini,gpt-4o-mini,0,8,,,,,,,,,
138,14,autonomous,police,I’m sorry to hear about your experience. It sounds like a frustrating situation. Could you please share the date when this incident happened?,2025-08-07T10:17:33.923747,gpt-4o-mini,gpt-4o-mini,0,8,"{""scam_incident_date"": """", ""scam_type"": ""ECOMMERCE"", ""scam_approach_platform"": ""CAROUSELL"", ""scam_communication_platform"": """", ""scam_transaction_type"": """", ""scam_beneficiary_platform"": """", ""scam_beneficiary_identifier"": """", ""scam_contact_no"": """", ""scam_email"": """", ""scam_moniker"": """", ""scam_url_link"": """", ""scam_amount_lost"": 0.0, ""scam_incident_description"": ""I encountered a scam while trying to purchase an iPhone on Carousell.""}",true,"{""scam_type"": ""ECOMMERCE"", ""scam_details"": [""scam url"", ""scammer contact number"", ""scammer email"", ""scammer moniker"", ""bank account number"", ""type of product being sold"", ""communication platform type"", ""scam transaction type"", ""payment method"", ""impersonated seller role""]}",false,"{""tech_literacy"": {""score"": 0.5023076923076923, ""level"": ""high"", ""confidence"": 0.65}, ""language_proficiency"": {""score"": 0.5028571428571429, ""level"": ""high"", ""confidence"": 0.7}, ""emotional_state"": {""score"": 0.5023076923076923, ""level"": ""neutral"", ""confidence"": 0.65}}","{""tech_literacy"": {""score"": 0.5023076923076923, ""level"": ""high"", ""confidence"": 0.65}, ""language_proficiency"": {""score"": 0.5028571428571429, ""level"": ""high"", ""confidence"": 0.7}, ""emotional_state"": {""score"": 0.5023076923076923, ""level"": ""neutral"", ""confidence"": 0.65}}","[{""strategy_type"": ""focused probing""}, {""strategy_type"": ""fact-finding with context""}, {""strategy_type"": ""information_gathering""}, {""strategy_type"": ""straightforward inquiry""}, {""strategy_type"": ""prompting""}]",{},
139,14,autonomous,victim,"The incident took place on June 22, 2025, when I made a purchase on Carousell.",2025-08-07T10:17:34.901552,gpt-4o-mini,gpt-4o-mini,1,8,,,,,,,,,
140,14,autonomous,police,"Thank you for providing the date. To proceed, could you share how you communicated with the seller after the purchase? Was it through email, WhatsApp, or another platform?",2025-08-07T10:17:44.028812,gpt-4o-mini,gpt-4o-mini,1,8,"{""scam_incident_date"": ""2025-06-22"", ""scam_type"": ""ECOMMERCE"", ""scam_approach_platform"": ""CAROUSELL"", ""scam_communication_platform"": """", ""scam_transaction_type"": """", ""scam_beneficiary_platform"": """", ""scam_beneficiary_identifier"": """", ""scam_contact_no"": """", ""scam_email"": """", ""scam_moniker"": """", ""scam_url_link"": """", ""scam_amount_lost"": 0.0, ""scam_incident_description"": ""I encountered a scam while trying to purchase an iPhone on Carousell on June 22, 2025.""}",true,"{""scam_type"": ""ECOMMERCE"", ""scam_details"": [""scam url"", ""scam moniker"", ""scammer contact number"", ""bank account identifier"", ""type of platform used"", ""product type being sold"", ""impersonated entity in communication"", ""requested payment method""]}",true,"{""tech_literacy"": {""score"": 0.5029995225464191, ""level"": ""high"", ""confidence"": 0.7250000000000001}, ""language_proficiency"": {""score"": 0.5032838095238095, ""level"": ""high"", ""confidence"": 0.75}, ""emotional_state"": {""score"": 0.5034044168734492, ""level"": ""neutral"", ""confidence"": 0.775}}","{""tech_literacy"": {""score"": 0.5023076923076923, ""level"": ""high"", ""confidence"": 0.65}, ""language_proficiency"": {""score"": 0.5028571428571429, ""level"": ""high"", ""confidence"": 0.7}, ""emotional_state"": {""score"": 0.5023076923076923, ""level"": ""neutral"", ""confidence"": 0.65}}","[{""strategy_type"": ""focused probing""}, {""strategy_type"": ""fact-finding with context""}, {""strategy_type"": ""information_gathering""}, {""strategy_type"": ""straightforward inquiry""}, {""strategy_type"": ""prompting""}]","{""strategy_type"": ""empathetic inquiry"", ""success_score"": 0.528846153846154, ""user_profile"": {""tech_literacy"": {""level"": ""high"", ""confidence"": 0.65}, ""language_proficiency"": {""level"": ""high"", ""confidence"": 0.7}, ""emotional_state"": {""level"": ""neutral"", ""confidence"": 0.65}}}",
141,14,autonomous,victim,I communicated with the seller through Carousell. That's where I first found the listing and contacted them for details.,2025-08-07T10:17:45.322873,gpt-4o-mini,gpt-4o-mini,2,8,,,,,,,,,
142,14,autonomous,police,"Thanks for letting me know you communicated through Carousell. Now, could you tell me how you made the payment for the iPhone? Was it a bank transfer, credit card, or another method?",2025-08-07T10:17:54.991939,gpt-4o-mini,gpt-4o-mini,2,8,"{""scam_incident_date"": ""2025-06-22"", ""scam_type"": ""ECOMMERCE"", ""scam_approach_platform"": ""CAROUSELL"", ""scam_communication_platform"": ""CAROUSELL"", ""scam_transaction_type"": """", ""scam_beneficiary_platform"": """", ""scam_beneficiary_identifier"": """", ""scam_contact_no"": """", ""scam_email"": """", ""scam_moniker"": """", ""scam_url_link"": """", ""scam_amount_lost"": 0.0, ""scam_incident_description"": ""I encountered a scam while trying to purchase an iPhone on Carousell on June 22, 2025. I communicated with the seller through Carousell.""}",true,"{""scam_type"": ""ECOMMERCE"", ""scam_details"": [""scam url"", ""scammer contact number"", ""scammer email"", ""scammer moniker"", ""product type being sold"", ""payment method used"", ""type of platform used for listing"", ""type of communication platform used"", ""impersonated entity or persona""]}",true,"{""tech_literacy"": {""score"": 0.5030942424542332, ""level"": ""high"", ""confidence"": 0.7625000000000001}, ""language_proficiency"": {""score"": 0.5037461998268398, ""level"": ""high"", ""confidence"": 0.825}, ""emotional_state"": {""score"": 0.5033508145905707, ""level"": ""neutral"", ""confidence"": 0.8125}}","{""tech_literacy"": {""score"": 0.5023076923076923, ""level"": ""high"", ""confidence"": 0.65}, ""language_proficiency"": {""score"": 0.5028571428571429, ""level"": ""high"", ""confidence"": 0.7}, ""emotional_state"": {""score"": 0.5023076923076923, ""level"": ""neutral"", ""confidence"": 0.65}}","[{""strategy_type"": ""focused probing""}, {""strategy_type"": ""fact-finding with context""}, {""strategy_type"": ""information_gathering""}, {""strategy_type"": ""straightforward inquiry""}, {""strategy_type"": ""prompting""}]","{""strategy_type"": ""contextual probing"", ""success_score"": 0.5038461538461538, ""user_profile"": {""tech_literacy"": {""level"": ""high"", ""confidence"": 0.65}, ""language_proficiency"": {""level"": ""high"", ""confidence"": 0.7}, ""emotional_state"": {""level"": ""neutral"", ""confidence"": 0.65}}}",
143,14,autonomous,victim,I made a bank transfer to the seller for the payment. She insisted on receiving the full amount upfront before shipping the iPhone.,2025-08-07T10:17:56.488091,gpt-4o-mini,gpt-4o-mini,3,8,,,,,,,,,
144,14,autonomous,police,"Thanks for sharing the payment method. Let's move on to the next details—do you have the name or alias of the seller? Also, could you share the seller's contact number or email if you have that information?",2025-08-07T10:18:06.096347,gpt-4o-mini,gpt-4o-mini,3,8,"{""scam_incident_date"": ""2025-06-22"", ""scam_type"": ""ECOMMERCE"", ""scam_approach_platform"": ""CAROUSELL"", ""scam_communication_platform"": ""CAROUSELL"", ""scam_transaction_type"": ""BANK TRANSFER"", ""scam_beneficiary_platform"": """", ""scam_beneficiary_identifier"": """", ""scam_contact_no"": """", ""scam_email"": """", ""scam_moniker"": """", ""scam_url_link"": """", ""scam_amount_lost"": 0.0, ""scam_incident_description"": ""I encountered a scam while trying to purchase an iPhone on Carousell on June 22, 2025. I communicated with the seller through Carousell and made a bank transfer for the payment.""}",true,"{""scam_type"": ""ECOMMERCE"", ""scam_details"": [""scam url"", ""scammer contact number"", ""scammer email"", ""scammer moniker"", ""type of product sold"", ""transaction type"", ""payment method"", ""impersonated seller behavior""]}",true,"{""tech_literacy"": {""score"": 0.5029829580159116, ""level"": ""high"", ""confidence"": 0.78125}, ""language_proficiency"": {""score"": 0.5037313837644418, ""level"": ""high"", ""confidence"": 0.8625}, ""emotional_state"": {""score"": 0.5031488612382813, ""level"": ""neutral"", ""confidence"": 0.83125}}","{""tech_literacy"": {""score"": 0.5023076923076923, ""level"": ""high"", ""confidence"": 0.65}, ""language_proficiency"": {""score"": 0.5028571428571429, ""level"": ""high"", ""confidence"": 0.7}, ""emotional_state"": {""score"": 0.5023076923076923, ""level"": ""neutral"", ""confidence"": 0.65}}","[{""strategy_type"": ""focused probing""}, {""strategy_type"": ""fact-finding with context""}, {""strategy_type"": ""information_gathering""}, {""strategy_type"": ""straightforward inquiry""}, {""strategy_type"": ""prompting""}]","{""strategy_type"": ""contextual probing"", ""success_score"": 0.5038461538461538, ""user_profile"": {""tech_literacy"": {""level"": ""high"", ""confidence"": 0.65}, ""language_proficiency"": {""level"": ""high"", ""confidence"": 0.7}, ""emotional_state"": {""level"": ""neutral"", ""confidence"": 0.65}}}",
145,14,autonomous,victim,The seller's alias was 'alexa83'. I don't have any contact number or email for them; communication was only through Carousell.,2025-08-07T10:18:07.275014,gpt-4o-mini,gpt-4o-mini,4,8,,,,,,,,,
146,14,autonomous,police,"I see, thank you for providing the seller's alias. Now, could you share the bank account number or details where you transferred the payment? It's important for the report. Also, do you have a URL link of the listing or any scam-related pages?",2025-08-07T10:18:17.168839,gpt-4o-mini,gpt-4o-mini,4,8,"{""scam_incident_date"": ""2025-06-22"", ""scam_type"": ""ECOMMERCE"", ""scam_approach_platform"": ""CAROUSELL"", ""scam_communication_platform"": ""CAROUSELL"", ""scam_transaction_type"": ""BANK TRANSFER"", ""scam_beneficiary_platform"": """", ""scam_beneficiary_identifier"": """", ""scam_contact_no"": """", ""scam_email"": """", ""scam_moniker"": ""alexa83"", ""scam_url_link"": """", ""scam_amount_lost"": 0.0, ""scam_incident_description"": ""I encountered a scam while trying to purchase an iPhone on Carousell on June 22, 2025. I communicated with the seller through Carousell and made a bank transfer for the payment.""}",true,"{""scam_type"": ""ECOMMERCE"", ""scam_details"": [""scam url"", ""scammer moniker"", ""scammer contact number"", ""scammer email"", ""scam beneficiary account"", ""product type being sold"", ""method of payment requested"", ""payment amount"", ""communication platform used"", ""approach platform used""]}",true,"{""tech_literacy"": {""score"": 0.5028216208437922, ""level"": ""high"", ""confidence"": 0.790625}, ""language_proficiency"": {""score"": 0.5035658082897627, ""level"": ""high"", ""confidence"": 0.8812500000000001}, ""emotional_state"": {""score"": 0.5029304934162668, ""level"": ""neutral"", ""confidence"": 0.840625}}","{""tech_literacy"": {""score"": 0.5023076923076923, ""level"": ""high"", ""confidence"": 0.65}, ""language_proficiency"": {""score"": 0.5028571428571429, ""level"": ""high"", ""confidence"": 0.7}, ""emotional_state"": {""score"": 0.5023076923076923, ""level"": ""neutral"", ""confidence"": 0.65}}","[{""strategy_type"": ""focused probing""}, {""strategy_type"": ""fact-finding with context""}, {""strategy_type"": ""information_gathering""}, {""strategy_type"": ""straightforward inquiry""}, {""strategy_type"": ""prompting""}]","{""strategy_type"": ""collaborative information gathering"", ""success_score"": 0.528846153846154, ""user_profile"": {""tech_literacy"": {""level"": ""high"", ""confidence"": 0.65}, ""language_proficiency"": {""level"": ""high"", ""confidence"": 0.7}, ""emotional_state"": {""level"": ""neutral"", ""confidence"": 0.65}}}",
147,14,autonomous,victim,I transferred the money to a GXS account with the identifier 63794026. I don't have a URL link or anything like that; I just found the listing on Carousell and interacted with the seller there.,2025-08-07T10:18:18.650188,gpt-4o-mini,gpt-4o-mini,5,8,,,,,,,,,
